Microsoft Windows [Version 10.0.19045.5487]
(c) Microsoft Corporation. All rights reserved.

C:\Users\tj-bu-703-08>mysql -uroot -p;
mysql: [Warning] Using a password on the command line interface can be insecure.
ERROR 1045 (28000): Access denied for user 'root'@'localhost' (using password: YES)

C:\Users\tj-bu-703-08>mysql -uroot -p
Enter password: ****
Welcome to the MySQL monitor.  Commands end with ; or \g.
Your MySQL connection id is 523
Server version: 8.0.41 MySQL Community Server - GPL

Copyright (c) 2000, 2025, Oracle and/or its affiliates.

Oracle is a registered trademark of Oracle Corporation and/or its
affiliates. Other names may be trademarks of their respective
owners.

Type 'help;' or '\h' for help. Type '\c' to clear the current input statement.

mysql> use emp;
Database changed
mysql> select deptno,job,avg(sal) from emp where sal<=3000 group by deptno,job having avg(sal)>=2000;
+--------+---------+-----------+
| deptno | job     | avg(sal)  |
+--------+---------+-----------+
|     20 | MANAGER | 2975.0000 |
|     30 | MANAGER | 2850.0000 |
|     10 | MANAGER | 2450.0000 |
|     20 | ANALYST | 3000.0000 |
+--------+---------+-----------+
4 rows in set (0.00 sec)

mysql> select deptno,job,cont(*) as '사원수' ,max(sal) as'최고급여',sum(sal) as '급여합', avg(sal) as '평균급여' from emp group by deptno,job;
ERROR 1064 (42000): You have an error in your SQL syntax; check the manual that corresponds to your MySQL server version for the right syntax to use near '*) as '??????' ,max(sal) as'?斂??乍?',sum(sal) as '?乍???', avg(sal) as '???欄乍' at line 1
mysql> select deptno,job,cont(*) as '사원수' ,max(sal) as'최고급여',sum(sal) as '급여합', avg(sal) as '평균급여' from emp group by deptno,job;
ERROR 1064 (42000): You have an error in your SQL syntax; check the manual that corresponds to your MySQL server version for the right syntax to use near '*) as '??????' ,max(sal) as'?斂??乍?',sum(sal) as '?乍???', avg(sal) as '???欄乍' at line 1
mysql> ERROR 1064 (42000): You have an error in your SQL syntax; check the manual that corresponds to your MySQL server version for the right syntax to use near '*) as '??????' ,max(sal) as'?斂??乍?',sum(sal) as '?乍???', avg(sal) as '???欄乍' at line 1
ERROR 1064 (42000): You have an error in your SQL syntax; check the manual that corresponds to your MySQL server version for the right syntax to use near 'ERROR 1064 (42000): You have an error in your SQL syntax' at line 1
    '> ^C
mysql> select deptno, job, count(*) as '사원수', max(sal) as '최고급여', sum(sal) as '급여합', avg(sal) as '평균급여' from emp group by deptno, job;
+--------+-----------+--------+----------+--------+-----------+
| deptno | job       | 사원수 | 최고급여 | 급여합 | 평균급여  |
+--------+-----------+--------+----------+--------+-----------+
|     20 | CLERK     |      2 |     1100 |   1900 |  950.0000 |
|     30 | SALESMAN  |      4 |     1600 |   5600 | 1400.0000 |
|     20 | MANAGER   |      1 |     2975 |   2975 | 2975.0000 |
|     30 | MANAGER   |      1 |     2850 |   2850 | 2850.0000 |
|     10 | MANAGER   |      1 |     2450 |   2450 | 2450.0000 |
|     20 | ANALYST   |      2 |     3000 |   6000 | 3000.0000 |
|     10 | PRESIDENT |      1 |     5000 |   5000 | 5000.0000 |
|     30 | CLERK     |      1 |      950 |    950 |  950.0000 |
|     10 | CLERK     |      1 |     1300 |   1300 | 1300.0000 |
+--------+-----------+--------+----------+--------+-----------+
9 rows in set (0.00 sec)

mysql> select deptno, job, count(*) as '사원수', max(sal) as '최고급여', sum(sal) as '급여합', avg(sal) as '평균급여' from emp group by deptno, job order by deptno desc;
+--------+-----------+--------+----------+--------+-----------+
| deptno | job       | 사원수 | 최고급여 | 급여합 | 평균급여  |
+--------+-----------+--------+----------+--------+-----------+
|     30 | CLERK     |      1 |      950 |    950 |  950.0000 |
|     30 | MANAGER   |      1 |     2850 |   2850 | 2850.0000 |
|     30 | SALESMAN  |      4 |     1600 |   5600 | 1400.0000 |
|     20 | ANALYST   |      2 |     3000 |   6000 | 3000.0000 |
|     20 | CLERK     |      2 |     1100 |   1900 |  950.0000 |
|     20 | MANAGER   |      1 |     2975 |   2975 | 2975.0000 |
|     10 | CLERK     |      1 |     1300 |   1300 | 1300.0000 |
|     10 | MANAGER   |      1 |     2450 |   2450 | 2450.0000 |
|     10 | PRESIDENT |      1 |     5000 |   5000 | 5000.0000 |
+--------+-----------+--------+----------+--------+-----------+
9 rows in set (0.00 sec)

mysql> select deptno, job, count(*) as '사원수', max(sal) as '최고급여', sum(sal) as '급여합', avg(sal) as '평균급여' from emp group by deptno, job order by deptno;
+--------+-----------+--------+----------+--------+-----------+
| deptno | job       | 사원수 | 최고급여 | 급여합 | 평균급여  |
+--------+-----------+--------+----------+--------+-----------+
|     10 | CLERK     |      1 |     1300 |   1300 | 1300.0000 |
|     10 | MANAGER   |      1 |     2450 |   2450 | 2450.0000 |
|     10 | PRESIDENT |      1 |     5000 |   5000 | 5000.0000 |
|     20 | ANALYST   |      2 |     3000 |   6000 | 3000.0000 |
|     20 | CLERK     |      2 |     1100 |   1900 |  950.0000 |
|     20 | MANAGER   |      1 |     2975 |   2975 | 2975.0000 |
|     30 | CLERK     |      1 |      950 |    950 |  950.0000 |
|     30 | MANAGER   |      1 |     2850 |   2850 | 2850.0000 |
|     30 | SALESMAN  |      4 |     1600 |   5600 | 1400.0000 |
+--------+-----------+--------+----------+--------+-----------+
9 rows in set (0.00 sec)

mysql> select cell(1.1) '올림', floor(1.9) '내림', round(1.5) '반올림', mod(10,3) '나머지';
ERROR 1305 (42000): FUNCTION emp.cell does not exist
mysql> select ceil(1.1) '올림', floor(1.9) '내림', round(1.5) '반올림', mod(10,3) '나머지';
+------+------+--------+--------+
| 올림 | 내림 | 반올림 | 나머지 |
+------+------+--------+--------+
|    2 |    1 |      2 |      1 |
+------+------+--------+--------+
1 row in set (0.00 sec)

mysql> select 123.4578, ceil(123.4567) 'ROUND1', floor(123.4567) 'ROUND2', round(123.4567) 'ROUND3', round(123.4567);
+----------+--------+--------+--------+-----------------+
| 123.4578 | ROUND1 | ROUND2 | ROUND3 | round(123.4567) |
+----------+--------+--------+--------+-----------------+
| 123.4578 |    124 |    123 |    123 |             123 |
+----------+--------+--------+--------+-----------------+
1 row in set (0.00 sec)

mysql> select 123.4578, ceil(123.4567) 'ROUND1', floor(123.4567) 'ROUND2', round(123.4567) 'ROUND3', round(123.4567) 'ROUND4';
+----------+--------+--------+--------+--------+
| 123.4578 | ROUND1 | ROUND2 | ROUND3 | ROUND4 |
+----------+--------+--------+--------+--------+
| 123.4578 |    124 |    123 |    123 |    123 |
+----------+--------+--------+--------+--------+
1 row in set (0.00 sec)

mysql>  select 123.4578, round(123.4567) 'ROUND1', floor(123.4567) 'ROUND2', round(123.4567) 'ROUND3', round(123.4567) 'ROUND4';
+----------+--------+--------+--------+--------+
| 123.4578 | ROUND1 | ROUND2 | ROUND3 | ROUND4 |
+----------+--------+--------+--------+--------+
| 123.4578 |    123 |    123 |    123 |    123 |
+----------+--------+--------+--------+--------+
1 row in set (0.00 sec)

mysql> select 123.4578, round(123.4567) 'ROUND1', floor(123.4567) 'ROUND2', round(123.4567) 'ROUND3', round(123.4567) 'ROUND4';
+----------+--------+--------+--------+--------+
| 123.4578 | ROUND1 | ROUND2 | ROUND3 | ROUND4 |
+----------+--------+--------+--------+--------+
| 123.4578 |    123 |    123 |    123 |    123 |
+----------+--------+--------+--------+--------+
1 row in set (0.00 sec)

mysql> select 123.4578, round(123.4567) 'ROUND1', floor(123.4567/10) 'ROUND2', round(123.4567) 'ROUND3', round(123.4567) 'ROUND4';
+----------+--------+--------+--------+--------+
| 123.4578 | ROUND1 | ROUND2 | ROUND3 | ROUND4 |
+----------+--------+--------+--------+--------+
| 123.4578 |    123 |     12 |    123 |    123 |
+----------+--------+--------+--------+--------+
1 row in set (0.00 sec)

mysql> select 123.4578, round(123.4567) 'ROUND1', floor(123.4567/10)*10 'ROUND2', round(123.4567) 'ROUND3', round(123.4567) 'ROUND4';
+----------+--------+--------+--------+--------+
| 123.4578 | ROUND1 | ROUND2 | ROUND3 | ROUND4 |
+----------+--------+--------+--------+--------+
| 123.4578 |    123 |    120 |    123 |    123 |
+----------+--------+--------+--------+--------+
1 row in set (0.00 sec)

mysql> select 123.4578, round(123.4567) 'ROUND1', floor(123.4567/10)*10 'ROUND2', round(123.4567*100)/100 'ROUND3', round(123.4567) 'ROUND4';
+----------+--------+--------+----------+--------+
| 123.4578 | ROUND1 | ROUND2 | ROUND3   | ROUND4 |
+----------+--------+--------+----------+--------+
| 123.4578 |    123 |    120 | 123.4600 |    123 |
+----------+--------+--------+----------+--------+
1 row in set (0.00 sec)

mysql> select 123.4578, round(123.4567) 'ROUND1', floor(123.4567/10)*10 'ROUND2', round(123.4567*10)/10 'ROUND3', round(123.4567) 'ROUND4';
+----------+--------+--------+----------+--------+
| 123.4578 | ROUND1 | ROUND2 | ROUND3   | ROUND4 |
+----------+--------+--------+----------+--------+
| 123.4578 |    123 |    120 | 123.5000 |    123 |
+----------+--------+--------+----------+--------+
1 row in set (0.00 sec)

mysql> select 123.4578, round(123.4567) 'ROUND1', floor(123.4567/10)*10 'ROUND2', round(123.4567*10)/10 'ROUND3', round(123.4567*100)/100 'ROUND4';
+----------+--------+--------+----------+----------+
| 123.4578 | ROUND1 | ROUND2 | ROUND3   | ROUND4   |
+----------+--------+--------+----------+----------+
| 123.4578 |    123 |    120 | 123.5000 | 123.4600 |
+----------+--------+--------+----------+----------+
1 row in set (0.00 sec)

mysql> select 123.4567, ceil(123.4578), floor(123.4567);
+----------+----------------+-----------------+
| 123.4567 | ceil(123.4578) | floor(123.4567) |
+----------+----------------+-----------------+
| 123.4567 |            124 |             123 |
+----------+----------------+-----------------+
1 row in set (0.00 sec)

mysql> show table;
ERROR 1064 (42000): You have an error in your SQL syntax; check the manual that corresponds to your MySQL server version for the right syntax to use near '' at line 1
mysql> show tables;
+---------------+
| Tables_in_emp |
+---------------+
| emp           |
| emp_del       |
| select_emp    |
+---------------+
3 rows in set (0.00 sec)

mysql> use userinfo;
Database changed
mysql> show tables;
+--------------------+
| Tables_in_userinfo |
+--------------------+
| alter_coffee       |
| userinfo_alter     |
+--------------------+
2 rows in set (0.00 sec)

mysql> create table userinfo_string(
    -> no int not null default 0,
    -> name varhcar(20) not null,
    -> age int not null,
    -> email varchar(20) not null
    -> );
ERROR 1064 (42000): You have an error in your SQL syntax; check the manual that corresponds to your MySQL server version for the right syntax to use near 'varhcar(20) not null,
age int not null,
email varchar(20) not null
)' at line 3
mysql> create table userinfo_string(
    -> no int not null default 0,
    -> name varchar(20) not null,
    -> age int not null,
    -> email varchar(20) not null
    -> );
Query OK, 0 rows affected (0.02 sec)

mysql> insert userinfo_stirng values (1,"aaa",11,"aa@gmail.com");
ERROR 1146 (42S02): Table 'userinfo.userinfo_stirng' doesn't exist
mysql> insert userinfo_string values (1,"aaa",11,"aa@gmail.com");
Query OK, 1 row affected (0.01 sec)

mysql> insert userinfo_string values (2,"bbb",22,"bbb@gmail.com");
Query OK, 1 row affected (0.00 sec)

mysql> insert userinfo_string values (3,"ccc",33,"ccc@gmail.com");
Query OK, 1 row affected (0.00 sec)

mysql> insert userinfo_string values (4,"ddd",44,"ddd@gmail.com");
Query OK, 1 row affected (0.00 sec)

mysql> insert userinfo_string values (5,"abc",55,"abc@gmail.com");
Query OK, 1 row affected (0.00 sec)

mysql> insert userinfo_string values (6,"bca",66,"bca@gmail.com");
Query OK, 1 row affected (0.00 sec)

mysql> update userinfo_string set email="aaa@gmail.com" where no=1;
Query OK, 1 row affected (0.00 sec)
Rows matched: 1  Changed: 1  Warnings: 0

mysql> select * from userinfo_string;
+----+------+-----+---------------+
| no | name | age | email         |
+----+------+-----+---------------+
|  1 | aaa  |  11 | aaa@gmail.com |
|  2 | bbb  |  22 | bbb@gmail.com |
|  3 | ccc  |  33 | ccc@gmail.com |
|  4 | ddd  |  44 | ddd@gmail.com |
|  5 | abc  |  55 | abc@gmail.com |
|  6 | bca  |  66 | bca@gmail.com |
+----+------+-----+---------------+
6 rows in set (0.00 sec)

mysql> select name '이름',length(name) '갯수';
ERROR 1054 (42S22): Unknown column 'name' in 'field list'
mysql> select name '이름',length(name) '갯수' from userinfo_string;
+------+------+
| 이름 | 갯수 |
+------+------+
| aaa  |    3 |
| bbb  |    3 |
| ccc  |    3 |
| ddd  |    3 |
| abc  |    3 |
| bca  |    3 |
+------+------+
6 rows in set (0.00 sec)

mysql> select name, left(name,1) '첫번째글자',right(name,1) '마지막글자' from userinfo_string;
+------+------------+------------+
| name | 첫번째글자 | 마지막글자 |
+------+------------+------------+
| aaa  | a          | a          |
| bbb  | b          | b          |
| ccc  | c          | c          |
| ddd  | d          | d          |
| abc  | a          | c          |
| bca  | b          | a          |
+------+------------+------------+
6 rows in set (0.00 sec)

mysql> select name, replace(name,"aaa", "aaa 1등") from userinfo_string;
+------+--------------------------------+
| name | replace(name,"aaa", "aaa 1등") |
+------+--------------------------------+
| aaa  | aaa 1등                        |
| bbb  | bbb                            |
| ccc  | ccc                            |
| ddd  | ddd                            |
| abc  | abc                            |
| bca  | bca                            |
+------+--------------------------------+
6 rows in set, 1 warning (0.00 sec)

mysql> select concat(name," 는 개발자입니다.") '직업' from userinfo_string;
+----------------------+
| 직업                 |
+----------------------+
| aaa 는 개발자입니다. |
| bbb 는 개발자입니다. |
| ccc 는 개발자입니다. |
| ddd 는 개발자입니다. |
| abc 는 개발자입니다. |
| bca 는 개발자입니다. |
+----------------------+
6 rows in set, 1 warning (0.00 sec)

mysql> select upper(name)
    -> ^C
mysql> select upper(name) from userinfo_string;
+-------------+
| upper(name) |
+-------------+
| AAA         |
| BBB         |
| CCC         |
| DDD         |
| ABC         |
| BCA         |
+-------------+
6 rows in set (0.00 sec)

mysql> select lower(name) from userinfo_string;
+-------------+
| lower(name) |
+-------------+
| aaa         |
| bbb         |
| ccc         |
| ddd         |
| abc         |
| bca         |
+-------------+
6 rows in set (0.00 sec)

mysql> select name, instr(name,'b') where age>40 from userinfo_string;
ERROR 1064 (42000): You have an error in your SQL syntax; check the manual that corresponds to your MySQL server version for the right syntax to use near 'from userinfo_string' at line 1
mysql> select name, instr(name,'b') where age >= 40 from userinfo_string;
ERROR 1064 (42000): You have an error in your SQL syntax; check the manual that corresponds to your MySQL server version for the right syntax to use near 'from userinfo_string' at line 1
mysql> select name, instr(name,'b') from userinfo_string where age >=40;
+------+-----------------+
| name | instr(name,'b') |
+------+-----------------+
| ddd  |               0 |
| abc  |               2 |
| bca  |               1 |
+------+-----------------+
3 rows in set (0.00 sec)

mysql> select name,instr(name,'b') from userinfo_string where age>=40 order by desc;
ERROR 1064 (42000): You have an error in your SQL syntax; check the manual that corresponds to your MySQL server version for the right syntax to use near 'desc' at line 1
mysql> select name,instr(name,'b') from userinfo_string where age>=40 order by age desc;
+------+-----------------+
| name | instr(name,'b') |
+------+-----------------+
| bca  |               1 |
| abc  |               2 |
| ddd  |               0 |
+------+-----------------+
3 rows in set (0.00 sec)

mysql> select name,instr(name,'b') from userinfo_string where age>=40 order by age desc;
+------+-----------------+
| name | instr(name,'b') |
+------+-----------------+
| bca  |               1 |
| abc  |               2 |
| ddd  |               0 |
+------+-----------------+
3 rows in set (0.00 sec)

mysql> select name, replace(name,name, concat(left(name,1),"*",right(name,1))) from userinfo_string;
+------+------------------------------------------------------------+
| name | replace(name,name, concat(left(name,1),"*",right(name,1))) |
+------+------------------------------------------------------------+
| aaa  | a*a                                                        |
| bbb  | b*b                                                        |
| ccc  | c*c                                                        |
| ddd  | d*d                                                        |
| abc  | a*c                                                        |
| bca  | b*a                                                        |
+------+------------------------------------------------------------+
6 rows in set (0.00 sec)

mysql> CREATE TABLE userinfo_string2 LIKE userinfo_string;
Query OK, 0 rows affected (0.02 sec)

mysql> insert insert userinfo_string values (1,"aaaa",11,"aa@gmail.com");
ERROR 1064 (42000): You have an error in your SQL syntax; check the manual that corresponds to your MySQL server version for the right syntax to use near 'insert userinfo_string values (1,"aaaa",11,"aa@gmail.com")' at line 1
mysql> insert insert userinfo_string2 values (1,"aaaa",11,"aa@gmail.com");
ERROR 1064 (42000): You have an error in your SQL syntax; check the manual that corresponds to your MySQL server version for the right syntax to use near 'insert userinfo_string2 values (1,"aaaa",11,"aa@gmail.com")' at line 1
mysql> insert userinfo_string2 values (1,"aaaa",11,"aa@gmail.com");
Query OK, 1 row affected (0.00 sec)

mysql> insert userinfo_string2 values (2,"bbbb",22,"bbb@gmail.com");
Query OK, 1 row affected (0.00 sec)

mysql> insert userinfo_string2 values (3,"ccaac",33,"ccc@gmail.com");
Query OK, 1 row affected (0.00 sec)

mysql> insert userinfo_string2 values (4,"daadd",44,"abc@gmail.com");
Query OK, 1 row affected (0.00 sec)

mysql> insert userinfo_string2 values (5,"abc",55,"abc@gmail.com");
Query OK, 1 row affected (0.00 sec)

mysql> insert userinfo_string2 values (6,"baaca",66,"bca@gmail.com");
Query OK, 1 row affected (0.00 sec)

mysql> select *from userinfo_string2;
+----+-------+-----+---------------+
| no | name  | age | email         |
+----+-------+-----+---------------+
|  1 | aaaa  |  11 | aa@gmail.com  |
|  2 | bbbb  |  22 | bbb@gmail.com |
|  3 | ccaac |  33 | ccc@gmail.com |
|  4 | daadd |  44 | abc@gmail.com |
|  5 | abc   |  55 | abc@gmail.com |
|  6 | baaca |  66 | bca@gmail.com |
+----+-------+-----+---------------+
6 rows in set (0.00 sec)

mysql> update userinfo_string2 set email="aaa@gmail.com" where no=1;
Query OK, 1 row affected (0.00 sec)
Rows matched: 1  Changed: 1  Warnings: 0

mysql> update userinfo_string set name="bbaab" where no=2;
Query OK, 1 row affected (0.00 sec)
Rows matched: 1  Changed: 1  Warnings: 0

mysql> select name, replace(name,name, concat(left(name,1),"*",right(name,1))) 'test' from userinfo_string2;
+-------+------+
| name  | test |
+-------+------+
| aaaa  | a*a  |
| bbbb  | b*b  |
| ccaac | c*c  |
| daadd | d*d  |
| abc   | a*c  |
| baaca | b*a  |
+-------+------+
6 rows in set (0.00 sec)

mysql> select name, replace(name,name, concat(left(name,1),repeat("*"),right(name,1))) 'test' from userinfo_string2;
ERROR 1064 (42000): You have an error in your SQL syntax; check the manual that corresponds to your MySQL server version for the right syntax to use near '),right(name,1))) 'test' from userinfo_string2' at line 1
mysql> select name, concat(left(name, 1), repeat('*', length(name) - 2), right(name, 1)) as test from userinfo_string2;
+-------+-------+
| name  | test  |
+-------+-------+
| aaaa  | a**a  |
| bbbb  | b**b  |
| ccaac | c***c |
| daadd | d***d |
| abc   | a*c   |
| baaca | b***a |
+-------+-------+
6 rows in set (0.00 sec)

mysql> select *from userinfo_string2
    -> ^C
mysql> select * from userinfo_string2;
+----+-------+-----+---------------+
| no | name  | age | email         |
+----+-------+-----+---------------+
|  1 | aaaa  |  11 | aaa@gmail.com |
|  2 | bbbb  |  22 | bbb@gmail.com |
|  3 | ccaac |  33 | ccc@gmail.com |
|  4 | daadd |  44 | abc@gmail.com |
|  5 | abc   |  55 | abc@gmail.com |
|  6 | baaca |  66 | bca@gmail.com |
+----+-------+-----+---------------+
6 rows in set (0.00 sec)

mysql> show tables;
+--------------------+
| Tables_in_userinfo |
+--------------------+
| alter_coffee       |
| userinfo_alter     |
| userinfo_string    |
| userinfo_string2   |
+--------------------+
4 rows in set (0.00 sec)

mysql> create table date_userinfo(
    -> no int not null default 0,
    -> name varchar(100) not null,
    -> age int not null,
    -> date datetime default current_timestamp default_generated
    -> );
ERROR 1064 (42000): You have an error in your SQL syntax; check the manual that corresponds to your MySQL server version for the right syntax to use near 'default_generated
)' at line 5
mysql> create table date_userinfo(
    ->     -> no int not null default 0,
    ->     -> name varchar(100) not null,
    ->     -> age int not null,
    ->     -> date datetime default current_t^C
mysql> create table date_userinfo(
    ->     -> no int not null default 0,
    ->     -> name varchar(100) not null,
    ->     -> age int not null,
    ->     -> date datetime default current_timestamp default_generated^C
mysql> create table date_userinfo(
    -> no int not null default 0,
    ->  name varchar(100) not null,
    ->  age int not null,
    -> date datetime default current_timestamp
    -> );
Query OK, 0 rows affected (0.02 sec)

mysql> desc date_userinfo;
+-------+--------------+------+-----+-------------------+-------------------+
| Field | Type         | Null | Key | Default           | Extra             |
+-------+--------------+------+-----+-------------------+-------------------+
| no    | int          | NO   |     | 0                 |                   |
| name  | varchar(100) | NO   |     | NULL              |                   |
| age   | int          | NO   |     | NULL              |                   |
| date  | datetime     | YES  |     | CURRENT_TIMESTAMP | DEFAULT_GENERATED |
+-------+--------------+------+-----+-------------------+-------------------+
4 rows in set (0.00 sec)

mysql> insert date_userinfo values (1,"aaa",11,"2022-12-30 00:00:00");
Query OK, 1 row affected (0.00 sec)

mysql> insert date_userinfo values (2,"bbb",22,"2022-11-30 00:00:00");
Query OK, 1 row affected (0.00 sec)

mysql> insert date_userinfo values (3,"ccc",33,"2022-10-30 00:00:00");
Query OK, 1 row affected (0.00 sec)

mysql> insert date_userinfo values (4,"ddd",44,"2022-09-30 00:00:00");
Query OK, 1 row affected (0.00 sec)

mysql> select * from date_userinfo;
+----+------+-----+---------------------+
| no | name | age | date                |
+----+------+-----+---------------------+
|  1 | aaa  |  11 | 2022-12-30 00:00:00 |
|  2 | bbb  |  22 | 2022-11-30 00:00:00 |
|  3 | ccc  |  33 | 2022-10-30 00:00:00 |
|  4 | ddd  |  44 | 2022-09-30 00:00:00 |
+----+------+-----+---------------------+
4 rows in set (0.00 sec)

mysql> select name, date where date> "2022-11-01";
ERROR 1054 (42S22): Unknown column 'name' in 'field list'
mysql> select name, date from date_userinfo where date> "2022-11-01";
+------+---------------------+
| name | date                |
+------+---------------------+
| aaa  | 2022-12-30 00:00:00 |
| bbb  | 2022-11-30 00:00:00 |
+------+---------------------+
2 rows in set (0.00 sec)

mysql> select name, date from date_userinfo where date< "2022-11-01";
+------+---------------------+
| name | date                |
+------+---------------------+
| ccc  | 2022-10-30 00:00:00 |
| ddd  | 2022-09-30 00:00:00 |
+------+---------------------+
2 rows in set (0.00 sec)

mysql> select name,date,date_add(date, interval 100 day) from date_userinfo;
+------+---------------------+----------------------------------+
| name | date                | date_add(date, interval 100 day) |
+------+---------------------+----------------------------------+
| aaa  | 2022-12-30 00:00:00 | 2023-04-09 00:00:00              |
| bbb  | 2022-11-30 00:00:00 | 2023-03-10 00:00:00              |
| ccc  | 2022-10-30 00:00:00 | 2023-02-07 00:00:00              |
| ddd  | 2022-09-30 00:00:00 | 2023-01-08 00:00:00              |
+------+---------------------+----------------------------------+
4 rows in set (0.00 sec)

mysql> select name,date,date_add(date, interval 30 day) from date_userinfo where date_format(date,"%y")="12";
Empty set (0.00 sec)

mysql>  select name,date,date_add(date, interval 30 day) from date_userinfo where date_format(date,"%y")=12;
Empty set (0.00 sec)

mysql>  select name,date,date_add(date, interval 30 day) from date_userinfo where date_format(date,"%m")=12;
+------+---------------------+---------------------------------+
| name | date                | date_add(date, interval 30 day) |
+------+---------------------+---------------------------------+
| aaa  | 2022-12-30 00:00:00 | 2023-01-29 00:00:00             |
+------+---------------------+---------------------------------+
1 row in set (0.00 sec)

mysql> select name,date,date_add(date, interval 30 day) 'event' from date_userinfo where date_format(date,"%m")=12;
+------+---------------------+---------------------+
| name | date                | event               |
+------+---------------------+---------------------+
| aaa  | 2022-12-30 00:00:00 | 2023-01-29 00:00:00 |
+------+---------------------+---------------------+
1 row in set (0.00 sec)

mysql> select name, date_format(date,"%y년 %m월 %d일") from date_userinfo;
+------+------------------------------------+
| name | date_format(date,"%y년 %m월 %d일") |
+------+------------------------------------+
| aaa  | 22년 12월 30일                     |
| bbb  | 22년 11월 30일                     |
| ccc  | 22년 10월 30일                     |
| ddd  | 22년 09월 30일                     |
+------+------------------------------------+
4 rows in set, 1 warning (0.00 sec)

mysql> select name, date_format(date,"%y년 %m월 %d일") '가입날짜' from date_userinfo;
+------+----------------+
| name | 가입날짜       |
+------+----------------+
| aaa  | 22년 12월 30일 |
| bbb  | 22년 11월 30일 |
| ccc  | 22년 10월 30일 |
| ddd  | 22년 09월 30일 |
+------+----------------+
4 rows in set, 1 warning (0.00 sec)

mysql> create table select_emp;
ERROR 4028 (HY000): A table must have at least one visible column.
mysql> create table select_emp();
ERROR 1064 (42000): You have an error in your SQL syntax; check the manual that corresponds to your MySQL server version for the right syntax to use near ')' at line 1
mysql> CREATE TABLE select_emp (
    ->     id INT NOT NULL AUTO_INCREMENT,
    ->     PRIMARY KEY (id)
    -> );
Query OK, 0 rows affected (0.03 sec)

mysql> use select_emp;
ERROR 1049 (42000): Unknown database 'select_emp'
mysql> use select_emp;
ERROR 1049 (42000): Unknown database 'select_emp'
mysql> date(now);
ERROR 1064 (42000): You have an error in your SQL syntax; check the manual that corresponds to your MySQL server version for the right syntax to use near 'date(now)' at line 1
mysql> select now();
+---------------------+
| now()               |
+---------------------+
| 2025-03-21 12:25:08 |
+---------------------+
1 row in set (0.00 sec)

mysql> select datediff("2025-12-25",now());
+------------------------------+
| datediff("2025-12-25",now()) |
+------------------------------+
|                          279 |
+------------------------------+
1 row in set (0.00 sec)

mysql> select date_add(now(), interval 5 month);
+-----------------------------------+
| date_add(now(), interval 5 month) |
+-----------------------------------+
| 2025-08-21 12:26:49               |
+-----------------------------------+
1 row in set (0.00 sec)

mysql> select current_date - interval (weekday(current_date) + 1) day;
+---------------------------------------------------------+
| current_date - interval (weekday(current_date) + 1) day |
+---------------------------------------------------------+
| 2025-03-16                                              |
+---------------------------------------------------------+
1 row in set (0.00 sec)

mysql> select current_date + interval (7 - weekday(current_date) - 1) day;
+-------------------------------------------------------------+
| current_date + interval (7 - weekday(current_date) - 1) day |
+-------------------------------------------------------------+
| 2025-03-23                                                  |
+-------------------------------------------------------------+
1 row in set (0.00 sec)

mysql> create table control(no int);
Query OK, 0 rows affected (0.02 sec)

mysql> insert into valeus (1),(2),(3);
ERROR 1064 (42000): You have an error in your SQL syntax; check the manual that corresponds to your MySQL server version for the right syntax to use near '1),(2),(3)' at line 1
mysql> insert into values (1),(2),(3);
ERROR 1064 (42000): You have an error in your SQL syntax; check the manual that corresponds to your MySQL server version for the right syntax to use near 'values (1),(2),(3)' at line 1
mysql> insert into control values (1),(2),(3);
Query OK, 3 rows affected (0.01 sec)
Records: 3  Duplicates: 0  Warnings: 0

mysql> select * from control;
+------+
| no   |
+------+
|    1 |
|    2 |
|    3 |
+------+
3 rows in set (0.00 sec)

mysql> select no, if(no=1,"1이다","1이 아니다") from control;
+------+-------------------------------+
| no   | if(no=1,"1이다","1이 아니다") |
+------+-------------------------------+
|    1 | 1이다                         |
|    2 | 1이 아니다                    |
|    3 | 1이 아니다                    |
+------+-------------------------------+
3 rows in set, 2 warnings (0.00 sec)

mysql> select no, if(no>1,"1보다크다","1보다작다") from control;
+------+----------------------------------+
| no   | if(no>1,"1보다크다","1보다작다") |
+------+----------------------------------+
|    1 | 1보다작다                        |
|    2 | 1보다크다                        |
|    3 | 1보다크다                        |
+------+----------------------------------+
3 rows in set, 2 warnings (0.00 sec)

mysql> select no,case when no=1 then"1이다" no=2 then"2이다" no=3 then"3이다" else "123아니당" end from control;
ERROR 1064 (42000): You have an error in your SQL syntax; check the manual that corresponds to your MySQL server version for the right syntax to use near 'no=2 then"2?甄?" no=3 then"3?甄?" else "123?틈求?" end from control' at line 1
mysql> select no,case when no=1 then '1이다' when no=2 then '2이다' when no=3 then '3이다' else '123아니당' end  from control;
+------+------------------------------------------------------------------------------------------------+
| no   | case when no=1 then '1이다' when no=2 then '2이다' when no=3 then '3이다' else '123아니당' end |
+------+------------------------------------------------------------------------------------------------+
|    1 | 1이다                                                                                          |
|    2 | 2이다                                                                                          |
|    3 | 3이다                                                                                          |
+------+------------------------------------------------------------------------------------------------+
3 rows in set, 4 warnings (0.00 sec)

mysql> select no, case when no>2 then '크다'when no=2 then '2이다'when no<3 then '작다'endfrom control;
ERROR 1064 (42000): You have an error in your SQL syntax; check the manual that corresponds to your MySQL server version for the right syntax to use near 'endfrom control' at line 1
mysql> SELECT no,
    ->        CASE
    ->            WHEN no > 2 THEN '크다'
    ->            WHEN no = 2 THEN '2이다'
    ->            WHEN no < 2 THEN '작다'
    ->        END
    -> FROM control;
+------+----------------------------------------------------------------------------------------------------------------------------+
| no   | CASE
           WHEN no > 2 THEN '크다'
           WHEN no = 2 THEN '2이다'
           WHEN no < 2 THEN '작다'
       END |
+------+----------------------------------------------------------------------------------------------------------------------------+
|    1 | 작다                                                                                                                       |
|    2 | 2이다                                                                                                                      |
|    3 | 크다                                                                                                                       |
+------+----------------------------------------------------------------------------------------------------------------------------+
3 rows in set, 3 warnings (0.00 sec)

mysql> create if_userinfo(
    -> no int not null primary key auto_increment
    -> name varchar(100) not null^C
mysql> create if_userinfo(
    -> no int not null primary key auto_increment,
    -> name varchar(100) not null,
    -> age int default 0,
    -> sex char(1),
    -> sns char(1)
    -> );
ERROR 1064 (42000): You have an error in your SQL syntax; check the manual that corresponds to your MySQL server version for the right syntax to use near 'if_userinfo(
no int not null primary key auto_increment,
name varchar(100) not n' at line 1
mysql>  create table if_userinfo(
    ->  no int not null primary key auto_increment,
    -> name varchar(100) not null,
    -> age int default 0,
    -> sex char(1),
    -> sns char(1)
    -> );
Query OK, 0 rows affected (0.02 sec)

mysql> insert into if_userinfo values(1,'first',11,,n);
ERROR 1064 (42000): You have an error in your SQL syntax; check the manual that corresponds to your MySQL server version for the right syntax to use near ',n)' at line 1
mysql>  insert into if_userinfo (no,name,age,sns) values (1,'first',11,n);
ERROR 1054 (42S22): Unknown column 'n' in 'field list'
mysql> insert into if_userinfo (no,name,age,sns) values (1,'first',11,n);
ERROR 1054 (42S22): Unknown column 'n' in 'field list'
mysql> ERROR 1054 (42S22): Unknown column 'n' in 'field list'
    -> ^C
mysql> insert into if_userinfo (no,name,age,sns) values (1,'first',11,'n');
Query OK, 1 row affected (0.00 sec)

mysql> insert into if_userinfo values (2,'second',122,m,y);
ERROR 1054 (42S22): Unknown column 'm' in 'field list'
mysql> insert into if_userinfo values (2,'second',122,'m','y');
Query OK, 1 row affected (0.00 sec)

mysql> insert into if_userinfo values (3,'third',33,'m','y');
Query OK, 1 row affected (0.01 sec)

mysql> insert into if_userinfo values (4,'fourth',44,'f','n');
Query OK, 1 row affected (0.00 sec)

mysql> insert into if_userinfo values (5,'fifth',55,'f','y');
Query OK, 1 row affected (0.00 sec)

mysql> insert into if_userinfo values (6,'six',66,'m','n');
Query OK, 1 row affected (0.00 sec)

mysql> select * from if_userinfo;
+----+--------+------+------+------+
| no | name   | age  | sex  | sns  |
+----+--------+------+------+------+
|  1 | first  |   11 | NULL | n    |
|  2 | second |  122 | m    | y    |
|  3 | third  |   33 | m    | y    |
|  4 | fourth |   44 | f    | n    |
|  5 | fifth  |   55 | f    | y    |
|  6 | six    |   66 | m    | n    |
+----+--------+------+------+------+
6 rows in set (0.00 sec)

mysql> select no,name,age,sex,sns,if(sns='n','수신거부','수신가능') from if_userinfo;
+----+--------+------+------+------+-----------------------------------+
| no | name   | age  | sex  | sns  | if(sns='n','수신거부','수신가능') |
+----+--------+------+------+------+-----------------------------------+
|  1 | first  |   11 | NULL | n    | 수신거부                          |
|  2 | second |  122 | m    | y    | 수신가능                          |
|  3 | third  |   33 | m    | y    | 수신가능                          |
|  4 | fourth |   44 | f    | n    | 수신거부                          |
|  5 | fifth  |   55 | f    | y    | 수신가능                          |
|  6 | six    |   66 | m    | n    | 수신거부                          |
+----+--------+------+------+------+-----------------------------------+
6 rows in set, 2 warnings (0.00 sec)

mysql> select no,name,age,sex,sns,if(sns='n','수신거부','수신가능')'수신여부상태' from if_userinfo;
+----+--------+------+------+------+--------------+
| no | name   | age  | sex  | sns  | 수신여부상태 |
+----+--------+------+------+------+--------------+
|  1 | first  |   11 | NULL | n    | 수신거부     |
|  2 | second |  122 | m    | y    | 수신가능     |
|  3 | third  |   33 | m    | y    | 수신가능     |
|  4 | fourth |   44 | f    | n    | 수신거부     |
|  5 | fifth  |   55 | f    | y    | 수신가능     |
|  6 | six    |   66 | m    | n    | 수신거부     |
+----+--------+------+------+------+--------------+
6 rows in set, 2 warnings (0.00 sec)

mysql> select no,name,age,sex,sns,if(age>20,'성인','미성년자') '성인여부' from if_userinfo;
+----+--------+------+------+------+----------+
| no | name   | age  | sex  | sns  | 성인여부 |
+----+--------+------+------+------+----------+
|  1 | first  |   11 | NULL | n    | 미성년자 |
|  2 | second |  122 | m    | y    | 성인     |
|  3 | third  |   33 | m    | y    | 성인     |
|  4 | fourth |   44 | f    | n    | 성인     |
|  5 | fifth  |   55 | f    | y    | 성인     |
|  6 | six    |   66 | m    | n    | 성인     |
+----+--------+------+------+------+----------+
6 rows in set, 2 warnings (0.00 sec)

mysql> select if(sns='n',count(sns)) from if_userinfo;
ERROR 1064 (42000): You have an error in your SQL syntax; check the manual that corresponds to your MySQL server version for the right syntax to use near ') from if_userinfo' at line 1
mysql> select if(sns='n',count(*)) from if_userinfo;
ERROR 1064 (42000): You have an error in your SQL syntax; check the manual that corresponds to your MySQL server version for the right syntax to use near ') from if_userinfo' at line 1
mysql>  select if(sns='n',count(*),0) from if_userinfo;
ERROR 1140 (42000): In aggregated query without GROUP BY, expression #1 of SELECT list contains nonaggregated column 'userinfo.if_userinfo.sns'; this is incompatible with sql_mode=only_full_group_by
mysql> select if(sns='n',count(*),0) from if_userinfo;
ERROR 1140 (42000): In aggregated query without GROUP BY, expression #1 of SELECT list contains nonaggregated column 'userinfo.if_userinfo.sns'; this is incompatible with sql_mode=only_full_group_by
mysql>  select if(sns='n',count(*),0) from if_userinfo group by sns;
+------------------------+
| if(sns='n',count(*),0) |
+------------------------+
|                      3 |
|                      0 |
+------------------------+
2 rows in set (0.00 sec)

mysql> select if(sns='n',count(*)) from if_userinfo group by sns;
ERROR 1064 (42000): You have an error in your SQL syntax; check the manual that corresponds to your MySQL server version for the right syntax to use near ') from if_userinfo group by sns' at line 1
mysql> select if(sns='n',count(*),0) from if_userinfo group by sns;
+------------------------+
| if(sns='n',count(*),0) |
+------------------------+
|                      3 |
|                      0 |
+------------------------+
2 rows in set (0.00 sec)

mysql> use emp;
Database changed
mysql> select *from emp;
+-------+--------+-----------+------+------------+------+------+--------+
| empno | ename  | job       | mgr  | hiredate   | sal  | comm | deptno |
+-------+--------+-----------+------+------------+------+------+--------+
|  7369 | SMITH  | CLERK     | 7902 | 1980-12-17 |  800 | NULL |     20 |
|  7499 | ALLEN  | SALESMAN  | 7698 | 1981-02-20 | 1600 |  300 |     30 |
|  7521 | WARD   | SALESMAN  | 7698 | 1981-02-22 | 1250 |  500 |     30 |
|  7566 | JONES  | MANAGER   | 7839 | 1981-04-02 | 2975 | NULL |     20 |
|  7654 | MARTIN | SALESMAN  | 7698 | 1981-09-28 | 1250 | 1400 |     30 |
|  7698 | BLAKE  | MANAGER   | 7839 | 1981-05-01 | 2850 | NULL |     30 |
|  7782 | CLARK  | MANAGER   | 7839 | 1981-06-09 | 2450 | NULL |     10 |
|  7788 | SCOTT  | ANALYST   | 7566 | 1987-04-19 | 3000 | NULL |     20 |
|  7839 | KING   | PRESIDENT | NULL | 1981-11-17 | 5000 | NULL |     10 |
|  7844 | TURNER | SALESMAN  | 7698 | 1981-09-08 | 1500 |    0 |     30 |
|  7876 | ADAMS  | CLERK     | 7788 | 1987-05-23 | 1100 | NULL |     20 |
|  7900 | JAMES  | CLERK     | 7698 | 1981-12-03 |  950 | NULL |     30 |
|  7902 | FORD   | ANALYST   | 7566 | 1981-12-03 | 3000 | NULL |     20 |
|  7934 | MILLER | CLERK     | 7782 | 1982-01-23 | 1300 | NULL |     10 |
+-------+--------+-----------+------+------------+------+------+--------+
14 rows in set (0.00 sec)

mysql>  select ename,deptno, case when deptno=10 then'ACCOUNTING when deptno=20 then 'RESEARCH' when deptno=30 then 'SALES' end from emp;
    '> ^C
mysql> select ename,deptno, case when deptno=10 then'ACCOUNTING when deptno=20 then 'RESEARCH' when deptno=30 then 'SALES' end from emp;
    '> ^C
mysql> select ename,deptno, case when deptno=10 then'ACCOUNTING' when deptno=20 then 'RESEARCH' when deptno=30 then 'SALES' end from emp;
+--------+--------+-----------------------------------------------------------------------------------------------------+
| ename  | deptno | case when deptno=10 then'ACCOUNTING' when deptno=20 then 'RESEARCH' when deptno=30 then 'SALES' end |
+--------+--------+-----------------------------------------------------------------------------------------------------+
| SMITH  |     20 | RESEARCH                                                                                            |
| ALLEN  |     30 | SALES                                                                                               |
| WARD   |     30 | SALES                                                                                               |
| JONES  |     20 | RESEARCH                                                                                            |
| MARTIN |     30 | SALES                                                                                               |
| BLAKE  |     30 | SALES                                                                                               |
| CLARK  |     10 | ACCOUNTING                                                                                          |
| SCOTT  |     20 | RESEARCH                                                                                            |
| KING   |     10 | ACCOUNTING                                                                                          |
| TURNER |     30 | SALES                                                                                               |
| ADAMS  |     20 | RESEARCH                                                                                            |
| JAMES  |     30 | SALES                                                                                               |
| FORD   |     20 | RESEARCH                                                                                            |
| MILLER |     10 | ACCOUNTING                                                                                          |
+--------+--------+-----------------------------------------------------------------------------------------------------+
14 rows in set (0.00 sec)

mysql>  select ename,deptno, case when deptno=10 then'ACCOUNTING' when deptno=20 then 'RESEARCH' when deptno=30 then 'SALES' end '부서명' from emp;
+--------+--------+------------+
| ename  | deptno | 부서명     |
+--------+--------+------------+
| SMITH  |     20 | RESEARCH   |
| ALLEN  |     30 | SALES      |
| WARD   |     30 | SALES      |
| JONES  |     20 | RESEARCH   |
| MARTIN |     30 | SALES      |
| BLAKE  |     30 | SALES      |
| CLARK  |     10 | ACCOUNTING |
| SCOTT  |     20 | RESEARCH   |
| KING   |     10 | ACCOUNTING |
| TURNER |     30 | SALES      |
| ADAMS  |     20 | RESEARCH   |
| JAMES  |     30 | SALES      |
| FORD   |     20 | RESEARCH   |
| MILLER |     10 | ACCOUNTING |
+--------+--------+------------+
14 rows in set (0.00 sec)

mysql> select ename,job,case when job='CLERK' then '판매원' when job='SALESMAN' then '영업사원' else '사원' end 'job2' from emp;
+--------+-----------+----------+
| ename  | job       | job2     |
+--------+-----------+----------+
| SMITH  | CLERK     | 판매원   |
| ALLEN  | SALESMAN  | 영업사원 |
| WARD   | SALESMAN  | 영업사원 |
| JONES  | MANAGER   | 사원     |
| MARTIN | SALESMAN  | 영업사원 |
| BLAKE  | MANAGER   | 사원     |
| CLARK  | MANAGER   | 사원     |
| SCOTT  | ANALYST   | 사원     |
| KING   | PRESIDENT | 사원     |
| TURNER | SALESMAN  | 영업사원 |
| ADAMS  | CLERK     | 판매원   |
| JAMES  | CLERK     | 판매원   |
| FORD   | ANALYST   | 사원     |
| MILLER | CLERK     | 판매원   |
+--------+-----------+----------+
14 rows in set, 3 warnings (0.00 sec)

mysql>